{
  "$schema": "urn:texture-identity-manifest:schema:v5",
  "schema": "texture-identity-manifest",
  "schema_version": 5,
  "algorithm": {
    "name": "canonical-pixel-fingerprint",
    "version": 3,
    "canonical_color_domain": "encoded-rgba8",
    "canonical_view_policy": "compatible-non-srgb-srv",
    "srgb_behavior": "preserve-dds-encoded-rgba8-through-compatible-non-srgb-srv",
    "mip_selection_policy": "visible-most-detailed-normalized-cell-center-v3",
    "normalization_formula": "pixel=min(size-1,((2*id+1)*size)/(2*N))",
    "non_square_policy": "normalize-each-axis-independently",
    "small_texture_policy": "deterministic-cell-center-repetition",
    "incomplete_chain_policy": "use-decoded-dump-top-level-image-only",
    "candidate_resolutions": [
      16,
      32,
      64,
      128,
      256
    ],
    "payload": "v3:rN:rgba8-phash:<base64url>",
    "distance": "weighted-channel-dhash-statistics-v3",
    "tolerance_floor": 0.00784313725490196,
    "minimum_margin": 0.01568627450980392,
    "effective_tolerance": "max(tolerance_floor, maximum_intra_distance)",
    "selection_rule": "nearest_inter_distance - effective_tolerance >= minimum_margin",
    "reference_strategy": "per-identity-minimax-medoid-over-all-variants",
    "legacy_cache_policy": "reject-incompatible-algorithm-domain-sampling-or-payload-profile",
    "payload_profile": "rgba8-phash",
    "payload_bytes": 41,
    "distance_weights": {
      "channel_dhash_hamming": 0.75,
      "mean_mae": 0.15,
      "deviation_mae": 0.07,
      "alpha_coverage_absolute": 0.03
    }
  },
  "source": {
    "metadata_ref": "Metadata.json",
    "shader_texture_usage_ref": "ShaderTextureUsage.json",
    "resource_origin": "original-game-dump",
    "profile": "Showcase1",
    "allowed_profiles": [
      "Showcase1",
      "Dungeon1",
      "Dungeon2"
    ],
    "lod_dump_policy": "excluded",
    "image_source": "dump-top-level-dds-image"
  },
  "runtime_contract": {
    "prototype_abi_version": 3,
    "runtime_fingerprint_algorithm_version": 3,
    "abi_reference": "texture-role-v3",
    "abi_field_status": "aligned",
    "owner_scope_source": "active-draw-vb-ib-gate",
    "scan_bound_srvs_only": true,
    "cache_key": [
      "resource",
      "resource_version",
      "algorithm_version",
      "payload_profile",
      "resolution",
      "canonical_format",
      "absolute_mip"
    ],
    "analysis_phase": "present",
    "rule_scope_fields_emitted": false,
    "match_resolutions": [
      16,
      32,
      64,
      128,
      256
    ],
    "match_format_families": [
      "r8g8b8a8",
      "b8g8r8a8",
      "b8g8r8x8",
      "bc1",
      "bc2",
      "bc3",
      "bc4",
      "bc5",
      "bc6h",
      "bc7",
      "dxgi-<numeric-enum>"
    ],
    "collision_group_default": "default-r{resolution}-{descriptor_family}",
    "collision_policies": [
      "reject",
      "merge",
      "require_draw_context"
    ],
    "candidate_context_abi_status": "evidence-only-unmapped",
    "fingerprint_binding": "inline-match_fingerprint",
    "abi_status": "blocked",
    "abi_blockers": [
      "runtime-v3-game-parity-not-validated",
      "candidate-context-draw_context-mapping-not-implemented"
    ],
    "identity_counts": {
      "total": 1,
      "payload_ready_runtime_blocked": 1,
      "blocked_decoder": 0,
      "runtime_compatible": 0
    },
    "blocked_identity_count": 1
  },
  "identities": [
    {
      "identity": "texture:1234abcd",
      "legacy_resource_hash": "1234abcd",
      "fingerprint_status": "payload-ready-runtime-blocked",
      "variants": [
        {
          "variant": "dump-base",
          "context_ref": "texture:1234abcd|dump-base",
          "stable_resource_ref": "Components-0 t=1234abcd.dds",
          "fingerprint_source_ref": "Components-0 t=1234abcd.dds",
          "source_sha256": "8067a6fad4a8bb98dfff6fb8bdd21cd88f37f9c8842e4af4dba2d0ae8a6886cd",
          "width": 32,
          "height": 16,
          "mips": 2,
          "format": "B8G8R8A8_UNORM",
          "format_family": "b8g8r8a8",
          "source_is_srgb": false,
          "fingerprints": {
            "16": {
              "status": "payload-ready",
              "payload": "v3:r16:rgba8-phash:__________8AAAAAAAAAAAAAAAAAAAAAAAAAAAAAAAAQCAf_CQUAAP8=",
              "algorithm_version": 3,
              "canonical_color_domain": "encoded-rgba8",
              "canonical_view_policy": "compatible-non-srgb-srv",
              "canonical_resolution": 16,
              "canonical_format": "B8G8R8A8_UNORM",
              "absolute_mip": 0,
              "source_mip_role": "dump-top-level-image",
              "runtime_source_mip_role": "srv-visible-most-detailed",
              "source_mip_width": 32,
              "source_mip_height": 16,
              "declared_mips": 2,
              "available_complete_mips": 2,
              "mip_chain_complete": true,
              "mip_selection_policy": "visible-most-detailed-normalized-cell-center-v3",
              "source_is_srgb": false,
              "payload_abi_compatible": true,
              "runtime_compatible": false,
              "runtime_compatibility_blockers": [
                "runtime-v3-game-parity-not-validated"
              ],
              "offline_cache_identity": {
                "resource_version": "8067a6fad4a8bb98dfff6fb8bdd21cd88f37f9c8842e4af4dba2d0ae8a6886cd",
                "algorithm_version": 3,
                "resolution": 16,
                "canonical_format": "B8G8R8A8_UNORM",
                "absolute_mip": 0,
                "payload_profile": "rgba8-phash"
              },
              "payload_profile": "rgba8-phash"
            },
            "32": {
              "status": "payload-ready",
              "payload": "v3:r32:rgba8-phash:__________8AAAAAAAAAAAAAAAAAAAAAAAAAAAAAAAAQCAf_CQUAAP8=",
              "algorithm_version": 3,
              "canonical_color_domain": "encoded-rgba8",
              "canonical_view_policy": "compatible-non-srgb-srv",
              "canonical_resolution": 32,
              "canonical_format": "B8G8R8A8_UNORM",
              "absolute_mip": 0,
              "source_mip_role": "dump-top-level-image",
              "runtime_source_mip_role": "srv-visible-most-detailed",
              "source_mip_width": 32,
              "source_mip_height": 16,
              "declared_mips": 2,
              "available_complete_mips": 2,
              "mip_chain_complete": true,
              "mip_selection_policy": "visible-most-detailed-normalized-cell-center-v3",
              "source_is_srgb": false,
              "payload_abi_compatible": true,
              "runtime_compatible": false,
              "runtime_compatibility_blockers": [
                "runtime-v3-game-parity-not-validated"
              ],
              "offline_cache_identity": {
                "resource_version": "8067a6fad4a8bb98dfff6fb8bdd21cd88f37f9c8842e4af4dba2d0ae8a6886cd",
                "algorithm_version": 3,
                "resolution": 32,
                "canonical_format": "B8G8R8A8_UNORM",
                "absolute_mip": 0,
                "payload_profile": "rgba8-phash"
              },
              "payload_profile": "rgba8-phash"
            },
            "64": {
              "status": "payload-ready",
              "payload": "v3:r64:rgba8-phash:__________8AAAAAAAAAAAAAAAAAAAAAAAAAAAAAAAAQCAf_CQUAAP8=",
              "algorithm_version": 3,
              "canonical_color_domain": "encoded-rgba8",
              "canonical_view_policy": "compatible-non-srgb-srv",
              "canonical_resolution": 64,
              "canonical_format": "B8G8R8A8_UNORM",
              "absolute_mip": 0,
              "source_mip_role": "dump-top-level-image",
              "runtime_source_mip_role": "srv-visible-most-detailed",
              "source_mip_width": 32,
              "source_mip_height": 16,
              "declared_mips": 2,
              "available_complete_mips": 2,
              "mip_chain_complete": true,
              "mip_selection_policy": "visible-most-detailed-normalized-cell-center-v3",
              "source_is_srgb": false,
              "payload_abi_compatible": true,
              "runtime_compatible": false,
              "runtime_compatibility_blockers": [
                "runtime-v3-game-parity-not-validated"
              ],
              "offline_cache_identity": {
                "resource_version": "8067a6fad4a8bb98dfff6fb8bdd21cd88f37f9c8842e4af4dba2d0ae8a6886cd",
                "algorithm_version": 3,
                "resolution": 64,
                "canonical_format": "B8G8R8A8_UNORM",
                "absolute_mip": 0,
                "payload_profile": "rgba8-phash"
              },
              "payload_profile": "rgba8-phash"
            },
            "128": {
              "status": "payload-ready",
              "payload": "v3:r128:rgba8-phash:__________8AAAAAAAAAAAAAAAAAAAAAAAAAAAAAAAAQCAf_CQUAAP8=",
              "algorithm_version": 3,
              "canonical_color_domain": "encoded-rgba8",
              "canonical_view_policy": "compatible-non-srgb-srv",
              "canonical_resolution": 128,
              "canonical_format": "B8G8R8A8_UNORM",
              "absolute_mip": 0,
              "source_mip_role": "dump-top-level-image",
              "runtime_source_mip_role": "srv-visible-most-detailed",
              "source_mip_width": 32,
              "source_mip_height": 16,
              "declared_mips": 2,
              "available_complete_mips": 2,
              "mip_chain_complete": true,
              "mip_selection_policy": "visible-most-detailed-normalized-cell-center-v3",
              "source_is_srgb": false,
              "payload_abi_compatible": true,